id,word,translation,transcription,audioText,category,difficulty,mnemonic_short,mnemonic_full,example_en,example_ru,work_example_en,work_example_ru,image,status,review_stage,error_count,created_at
"basic-hello","hello","привет","/həˈləʊ/","hello","Basic A1","easy","Hello звучит как дружелюбное «хеллоу» при встрече.","Hello звучит как дружелюбное «хеллоу» при встрече.","Hello, I am Alex.","Привет, я Алекс.","Hello, the homepage draft is ready.","Привет, черновик главной страницы готов.","👋","new","0","0","2026-01-01"
"basic-today","today","сегодня","/təˈdeɪ/","today","Basic A1","easy","Today похоже на «ту дей» — день, который сейчас.","Основной крючок: Today звучит как «ту дей» — «тот день», который идёт прямо сейчас.

Образ: Представь календарь, где ярко подсвечена только сегодняшняя дата.

Формула: Today = сегодня, день, который сейчас.","Today is Monday.","Сегодня понедельник.","Today I will update the contact page.","Сегодня я обновлю страницу контактов.","📅","new","0","0","2026-01-02"
"basic-help","help","помощь; помочь","/help/","help","Basic A1","easy","Help легко запомнить как «хелп» — когда нужна помощь.","Help легко запомнить как «хелп» — когда нужна помощь.","Can you help me?","Ты можешь мне помочь?","This guide will help the client use the CMS.","Этот гид поможет клиенту пользоваться CMS.","🆘","new","0","0","2026-01-03"
"basic-page","page","страница","/peɪdʒ/","page","Basic A1","easy","Page похоже на «пейдж» — страница в книге или на сайте.","Page похоже на «пейдж» — страница в книге или на сайте.","Open the first page.","Открой первую страницу.","The services page needs a new headline.","Странице услуг нужен новый заголовок.","📄","new","0","0","2026-01-04"
"basic-text","text","текст","/tekst/","text","Basic A1","easy","Text почти как русское «текст».","Text почти как русское «текст».","The text is short.","Текст короткий.","Please check the hero text before publish.","Проверь текст в hero-блоке перед публикацией.","📝","new","0","0","2026-01-05"
"basic-image","image","изображение","/ˈɪmɪdʒ/","image","Basic A1","easy","Image похоже на «имидж», то есть визуальный образ.","Image похоже на «имидж», то есть визуальный образ.","This image is big.","Это изображение большое.","The image on the about page loads slowly.","Изображение на странице about загружается медленно.","🖼️","new","0","0","2026-01-06"
"basic-color","color","цвет","/ˈkʌlər/","color","Basic A1","easy","Color — это цвет, как в палитре дизайна.","Color — это цвет, как в палитре дизайна.","My favorite color is blue.","Мой любимый цвет — синий.","The button color is too dark on mobile.","Цвет кнопки слишком тёмный на мобильной версии.","🎨","new","0","0","2026-01-07"
"basic-button","button","кнопка","/ˈbʌtn/","button","Basic A1","easy","Button — это «баттон», знакомое слово из интерфейсов.","Button — это «баттон», знакомое слово из интерфейсов.","Click the green button.","Нажми зелёную кнопку.","The submit button is below the form.","Кнопка отправки находится под формой.","🔘","new","0","0","2026-01-08"
"basic-menu","menu","меню","/ˈmenjuː/","menu","Basic A1","easy","Menu почти как русское «меню».","Menu почти как русское «меню».","The menu is open.","Меню открыто.","The mobile menu covers the logo.","Мобильное меню перекрывает логотип.","📋","new","0","0","2026-01-09"
"basic-form","form","форма","/fɔːm/","form","Basic A1","easy","Form — это форма, особенно контактная форма на сайте.","Form — это форма, особенно контактная форма на сайте.","The form is simple.","Форма простая.","The contact form does not send data.","Контактная форма не отправляет данные.","🧾","new","0","0","2026-01-10"
"basic-link","link","ссылка","/lɪŋk/","link","Basic A1","easy","Link — это линк, то есть ссылка.","Link — это линк, то есть ссылка.","This link is new.","Эта ссылка новая.","Please send me the Webflow link.","Пожалуйста, пришлите мне ссылку на Webflow.","🔗","new","0","0","2026-01-11"
"basic-client","client","клиент","/ˈklaɪənt/","client","Basic A1","easy","Client почти как «клиент». Представь человека, который присылает тебе задачу и правки: client = клиент.","Client почти как «клиент». Представь человека, который присылает тебе задачу и правки: client = клиент.","The client is happy.","Клиент доволен.","The client wants a cleaner landing page.","Клиент хочет более чистую landing page.","🤝","new","0","0","2026-01-12"
"basic-task","task","задача","/tɑːsk/","task","Basic A1","easy","Task — это таск, рабочая задача. Представь карточку в списке дел: task = задача.","Task — это таск, рабочая задача. Представь карточку в списке дел: task = задача.","This task is easy.","Эта задача простая.","My first task is to fix the footer.","Моя первая задача — исправить футер.","✅","new","0","0","2026-01-13"
"webflow-section","section","секция","/ˈsekʃn/","section","Webflow","easy","Section — это секция, кусок страницы.","Section — это секция, кусок страницы.","This section is short.","Эта секция короткая.","The hero section needs more spacing.","Hero-секции нужно больше отступов.","📚","new","0","0","2026-01-14"
"webflow-container","container","контейнер","/kənˈteɪnə(r)/","container","Webflow","easy","Container — это контейнер, блок для содержимого.","Container — это контейнер, блок для содержимого.","The container is wide.","Контейнер широкий.","Set the container max width to 1200 pixels.","Поставь контейнеру максимальную ширину 1200 пикселей.","📦","new","0","0","2026-01-15"
"webflow-grid","grid","сетка","/ɡrɪd/","grid","Webflow","easy","Grid напоминает решётку, то есть сетку.","Grid напоминает решётку, то есть сетку.","The grid has two columns.","У сетки две колонки.","Use a grid for the team cards.","Используй сетку для карточек команды.","🔲","new","0","0","2026-01-16"
"webflow-class","class","класс","/klɑːs/","class","Webflow","easy","Class — тот самый CSS-класс.","Class — тот самый CSS-класс.","This class is new.","Этот класс новый.","Rename the class before you publish the page.","Переименуй класс перед публикацией страницы.","🏷️","new","0","0","2026-01-17"
"webflow-publish","publish","публиковать","/ˈpʌblɪʃ/","publish","Webflow","easy","Publish похоже на «паблиш» — выпустить наружу. Представь кнопку Publish, после которой страница выходит в интернет: publish = опубликовать.","Publish похоже на «паблиш» — выпустить наружу. Представь кнопку Publish, после которой страница выходит в интернет: publish = опубликовать.","We publish today.","Мы публикуем сегодня.","Do not publish before the client review.","Не публикуй до проверки клиента.","🚀","new","0","0","2026-01-18"
"webflow-breakpoint","breakpoint","брейкпоинт","/ˈbreɪkpɔɪnt/","breakpoint","Webflow","easy","Breakpoint — точка, где макет «ломается» на другой размер.","Breakpoint — точка, где макет «ломается» на другой размер.","The tablet breakpoint is active.","Планшетный брейкпоинт активен.","Check the tablet breakpoint before handoff.","Проверь планшетный брейкпоинт перед сдачей.","📱","new","0","0","2026-01-19"
"webflow-component","component","компонент","/kəmˈpəʊnənt/","component","Webflow","easy","Component — часть интерфейса, компонент.","Component — часть интерфейса, компонент.","This component is small.","Этот компонент маленький.","Make the card a reusable component.","Сделай карточку переиспользуемым компонентом.","🧩","new","0","0","2026-01-20"
"webflow-interaction","interaction","анимация; интеракция","/ˌɪntərˈækʃn/","interaction","Webflow","easy","Interaction — это то, как элемент реагирует на действие.","Interaction — это то, как элемент реагирует на действие.","The interaction is smooth.","Анимация плавная.","Add a hover interaction to the CTA button.","Добавь hover-анимацию на CTA-кнопку.","✨","new","0","0","2026-01-21"
"webflow-navbar","navbar","панель навигации","/ˈnævbɑː(r)/","navbar","Webflow","easy","Navbar = navigation bar, полоса навигации.","Navbar = navigation bar, полоса навигации.","The navbar is fixed.","Навбар закреплён.","The navbar logo is too small on desktop.","Логотип в навбаре слишком маленький на десктопе.","🧭","new","0","0","2026-01-22"
"webflow-collection","collection","коллекция","/kəˈlekʃn/","collection","Webflow","easy","Collection — это набор элементов, коллекция.","Collection — это набор элементов, коллекция.","The collection is empty.","Коллекция пустая.","Connect the blog card to the CMS collection.","Подключи карточку блога к CMS-коллекции.","🗂️","new","0","0","2026-01-23"
"webflow-cms","CMS","CMS","/ˌsiː.emˈes/","C M S","Webflow","easy","CMS запоминай как три буквы панели, где клиент меняет тексты и карточки. Представь таблицу с постами и отзывами: CMS = система управления контентом.","CMS запоминай как три буквы панели, где клиент меняет тексты и карточки. Представь таблицу с постами и отзывами: CMS = система управления контентом.","The CMS is simple.","CMS простая.","The client edits testimonials in the CMS.","Клиент редактирует отзывы в CMS.","🗃️","new","0","0","2026-01-24"
"webflow-slug","slug","адресный идентификатор","/slʌɡ/","slug","Webflow","easy","Slug представь как короткий хвост URL. Это маленькое имя страницы в адресной строке: slug = адресный идентификатор.","Slug представь как короткий хвост URL. Это маленькое имя страницы в адресной строке: slug = адресный идентификатор.","The slug is short.","Slug короткий.","Change the blog post slug before launch.","Измени slug поста до запуска.","🔠","new","0","0","2026-01-25"
"webflow-style","style","стиль","/staɪl/","style","Webflow","easy","Style почти как «стайл». Представь, что копируешь стиль кнопки со страницы: style = стиль.","Style почти как «стайл». Представь, что копируешь стиль кнопки со страницы: style = стиль.","This style is clean.","Этот стиль чистый.","Copy the button style from the main page.","Скопируй стиль кнопки с главной страницы.","🎛️","new","0","0","2026-01-26"
"design-layout","layout","макет; компоновка","/ˈleɪaʊt/","layout","Design","easy","Layout звучит как «лейаут». Представь разложенные блоки страницы: кто где стоит, тот и layout = макет.","Для слова Layout [ˈleɪaʊt] лучше всего работает разбор по смыслу: это то, как всё разложено на экране.

Фонетическая привязка:
- LAY OUT: Разбей слово на lay + out: как будто ты раскладываешь блоки страницы по местам.
- ЛЕЙАУТ: Запомни рабочее звучание «лейаут» как готовое слово про макет и компоновку.

Сюжет / Фраза: Ты смотришь на экран сверху и раскладываешь header, hero, карточки и footer по местам. Это и есть layout.

Визуальный образ: Представь пустую страницу, на которую ты по очереди выставляешь секции, колонки и кнопки, как мебель в комнате.

Связка (Mobile layout): Представь отдельно десктопный и мобильный экран. Mobile layout = мобильный макет.

Рабочий контекст: Layout — одно из самых частых слов в дизайне и Webflow: так называют общую структуру страницы.","The layout is clean.","Макет аккуратный.","The mobile layout needs one more row.","Мобильному макету нужна ещё одна строка.","📐","new","0","0","2026-01-27"
"design-spacing","spacing","отступы","/ˈspeɪsɪŋ/","spacing","Design","easy","Spacing связано со словом space. Представь воздух между карточками: spacing = отступы.","Для слова Spacing [ˈspeɪsɪŋ] лучше всего работает связь со словом space — пространство.

Фонетическая привязка:
- SPACE: Представь воздух между блоками, кнопками и строками. Это и есть spacing.
- СПЕЙСИНГ: Запомни профессиональное звучание «спейсинг» как систему отступов в интерфейсе.

Сюжет / Фраза: Если карточки слиплись, spacing плохой. Если между ними появился воздух, интерфейс сразу стал чище.

Визуальный образ: Представь три карточки, между которыми почти нет места. Ты увеличиваешь расстояние, и экран сразу начинает дышать.

Связка (More spacing): Представь задачу дизайнера: “Add more spacing between cards”. More spacing = больше отступов.

Рабочий контекст: Spacing — одно из ключевых рабочих слов, когда обсуждают аккуратность, ритм и читаемость интерфейса.","The spacing looks nice.","Отступы выглядят хорошо.","Increase the spacing between cards.","Увеличь отступы между карточками.","↔️","new","0","0","2026-01-28"
"design-contrast","contrast","контраст","/ˈkɒntrɑːst/","contrast","Design","easy","Contrast — это разница между светлым и тёмным. Представь белый текст на чёрном фоне: contrast = контраст.","Contrast — это разница между светлым и тёмным. Представь белый текст на чёрном фоне: contrast = контраст.","The contrast is low.","Контраст низкий.","The text contrast is weak on the hero image.","Контраст текста на hero-изображении слабый.","⚫","new","0","0","2026-02-01"
"design-align","align","выравнивать","/əˈlaɪn/","align","Design","easy","Align похоже на line. Представь, как ты ставишь элементы в одну линию: align = выравнивать.","Align похоже на line. Представь, как ты ставишь элементы в одну линию: align = выравнивать.","Align the title left.","Выровняй заголовок по левому краю.","Align the icons with the text labels.","Выровняй иконки по текстовым подписям.","📏","new","0","0","2026-02-02"
"design-font","font","шрифт","/fɒnt/","font","Design","easy","Font похоже на «фонд», где хранятся буквы. Представь папку со шрифтами проекта: font = шрифт.","Основной крючок: Font — это набор букв для интерфейса.

Образ: Представь папку, где лежат все шрифты проекта, и ты выбираешь нужный для заголовка.

Формула: Font = шрифт.","This font is easy to read.","Этот шрифт легко читать.","Use the same font in the footer and hero.","Используй один и тот же шрифт в футере и hero.","🔤","new","0","0","2026-02-03"
"design-icon","icon","иконка","/ˈaɪkɒn/","icon","Design","easy","Icon почти как «иконка». Представь маленький значок соцсети в футере: icon = иконка.","Icon почти как «иконка». Представь маленький значок соцсети в футере: icon = иконка.","The icon is small.","Иконка маленькая.","Replace the old social icon in the footer.","Замени старую иконку соцсети в футере.","🔔","new","0","0","2026-02-04"
"design-hero","hero","главный экран; hero-блок","/ˈhɪərəʊ/","hero","Design","easy","Hero — главный герой первого экрана. Представь самый большой верхний блок страницы: hero = hero-блок.","Hero — главный герой первого экрана. Представь самый большой верхний блок страницы: hero = hero-блок.","The hero is bright.","Hero-блок яркий.","The hero needs a stronger headline.","Hero-блоку нужен более сильный заголовок.","🌟","new","0","0","2026-02-05"
"design-template","template","шаблон","/ˈtempleɪt/","template","Design","easy","Template похоже на «темплейт». Представь готовую заготовку страницы, которую ты только наполняешь: template = шаблон.","Template похоже на «темплейт». Представь готовую заготовку страницы, которую ты только наполняешь: template = шаблон.","This template is simple.","Этот шаблон простой.","Use one template for all project pages.","Используй один шаблон для всех страниц проекта.","📑","new","0","0","2026-02-06"
"design-responsive","responsive","адаптивный","/rɪˈspɒnsɪv/","responsive","Design","easy","Responsive — сайт отвечает на размер экрана. Представь, как макет сам подстраивается под телефон: responsive = адаптивный.","Для слова Responsive [rɪˈspɒnsɪv] лучше всего работает идея правильной реакции на размер экрана.

Фонетическая привязка:
- RESPONSE: Responsive — тот, кто отвечает или реагирует. Сайт реагирует на телефон, планшет и десктоп.
- ПОДСТРАИВАЕТСЯ: Представь, как один и тот же блок меняет форму под разную ширину экрана.

Сюжет / Фраза: Макет не ломается, а умно перестраивается: на десктопе широко, на планшете компактнее, на телефоне — в одну колонку.

Визуальный образ: Представь сайт, который сам меняет расположение блоков, как живой конструктор, когда ты сужаешь экран.

Связка (Responsive design): Представь дизайн, который одинаково аккуратно работает на всех устройствах. Responsive design = адаптивный дизайн.

Рабочий контекст: Responsive — одно из самых базовых слов в Webflow и дизайне, потому что почти любой экран проверяют на адаптивность.","The site is responsive.","Сайт адаптивный.","We need a responsive gallery for mobile.","Нам нужна адаптивная галерея для мобильных.","📲","new","0","0","2026-02-07"
"design-margin","margin","внешний отступ","/ˈmɑːdʒɪn/","margin","Design","easy","Margin — это воздух снаружи блока. Представь пустое поле вокруг карточки: margin = внешний отступ.","Margin — это воздух снаружи блока. Представь пустое поле вокруг карточки: margin = внешний отступ.","The margin is too big.","Внешний отступ слишком большой.","Reduce the top margin above the form.","Уменьши верхний внешний отступ над формой.","⬜","new","0","0","2026-02-08"
"design-padding","padding","внутренний отступ","/ˈpædɪŋ/","padding","Design","easy","Padding напоминает мягкую подкладку внутри куртки. Представь воздух внутри кнопки или карточки: padding = внутренний отступ.","Padding напоминает мягкую подкладку внутри куртки. Представь воздух внутри кнопки или карточки: padding = внутренний отступ.","The padding is small.","Внутренний отступ маленький.","Add more padding inside the CTA card.","Добавь больше внутреннего отступа в CTA-карточку.","🪟","new","0","0","2026-02-09"
"design-palette","palette","палитра","/ˈpælət/","palette","Design","easy","Palette похоже на палитру художника. Представь дощечку с цветами бренда: palette = палитра.","Palette похоже на палитру художника. Представь дощечку с цветами бренда: palette = палитра.","The palette is soft.","Палитра мягкая.","The new palette fits the brand better.","Новая палитра лучше подходит бренду.","🖌️","new","0","0","2026-02-10"
"design-frame","frame","фрейм; рамка","/freɪm/","frame","Design","easy","Frame — это рамка или рабочий фрейм. Представь прямоугольную область в Figma, куда ты складываешь блоки: frame = фрейм.","Frame — это рамка или рабочий фрейм. Представь прямоугольную область в Figma, куда ты складываешь блоки: frame = фрейм.","The frame is large.","Фрейм большой.","Put the testimonial card inside one frame.","Помести карточку отзыва в один фрейм.","🪟","new","0","0","2026-02-11"
